Title,Authors,Publisher,Year,Abstract,DOI,Keywords,Citations,Remove - Title,Second Filter
DEEP NEURAL NETWORKS FOR ESTIMATION AND INFERENCE,"Farrell, MH; Liang, TY; Misra, S",ECONOMETRICA,2021.0,"We study deep neural networks and their use in semiparametric inference. We establish novel nonasymptotic high probability bounds for deep feedforward neural nets. These deliver rates of convergence that are sufficiently fast (in some cases minimax optimal) to allow us to establish valid second-step inference after first-step estimation with deep learning, a result also new to the literature. Our nonasymptotic high probability bounds, and the subsequent semiparametric inference, treat the current standard architecture: fully connected feedforward neural networks (multilayer perceptrons), with the now-common rectified linear unit activation function, unbounded weights, and a depth explicitly diverging with the sample size. We discuss other architectures as well, including fixed-width, very deep networks. We establish the nonasymptotic bounds for these deep nets for a general class of nonparametric regression-type loss functions, which includes as special cases least squares, logistic regression, and other generalized linear models. We then apply our theory to develop semiparametric inference, focusing on causal parameters for concreteness, and demonstrate the effectiveness of deep learning with an empirical application to direct mail marketing.",10.3982/ECTA16901,Deep learning; neural networks; rectified linear unit; nonasymptotic bounds; convergence rates; semiparametric inference; treatment effects; program evaluation,,0.0,1.0
A multiobjective optimization-based sparse extreme learning machine algorithm,"Wu, Y; Zhang, YS; Liu, XB; Cai, ZH; Cai, YM",NEUROCOMPUTING,2018.0,"Extreme Learning Machine (ELM) is a popular machine learning method and has been widely applied to real-world problems due to its fast training speed and good generalization performance. However, in ELM, the randomly assigned input weights and hidden biases usually degrade the generalization performance. Furthermore, ELM is considered as an empirical risk minimization model and easily leads to overfitting when dataset exists some outliers. In this paper, we proposed a novel algorithm named Multiobjective Optimization-based Sparse Extreme Learning Machine (MO-SELM), where parameter optimization and structure learning are integrated into the learning process to simultaneously enhance the generalization performance and alleviate the overfitting problem. In MO-SELM, the training error and the connecting sparsity are taken as two conflicting objectives of the multiobjective model, which aims to find sparse connecting structures with optimal weights and biases. Then, a hybrid encoding-based MOEA/D is used to optimize the multiobjective model. In addition, ensemble learning is embedded into this algorithm to make decisions after multiobjective optimization. Experimental results of several classification and regression applications demonstrate the effectiveness of the proposed MO-SELM. (C) 2018 Elsevier B.V. All rights reserved.",10.1016/j.neucom.2018.07.060,Extreme learning machine; Sparse connecting structure; Parameter optimization; Structure learning; Multiobjective optimization,,0.0,1.0
Maxi-min margin machine: Learning large margin classifiers locally and globally,"Huang, KZ; Yang, HQ; King, I; Lyu, MR",IEEE TRANSACTIONS ON NEURAL NETWORKS,2008.0,"In this paper, we propose a novel large margin classifier, called the maxi-min margin machine (M-4). This model learns the decision boundary both locally and globally. In comparison, other large margin classifiers construct separating hyperplanes only either locally or globally. For example, a state-of-the-art large margin classifier, the support vector machine (SVM), considers data only locally, while another significant model, the minimax probability machine (MPM), focuses on building the decision hyperplane exclusively based on the global information. As a major contribution, we show that SVM yields the same solution as M-4 when data satisfy certain conditions, and MPM can be regarded as a relaxation model of M-4. Moreover, based on our proposed local and global view of data, another popular model, the linear discriminant analysis, can easily be interpreted and extended as well. We describe the M-4 model definition, provide a geometrical interpretation, present theoretical justifications, and propose a practical sequential conic programming method to solve the optimization problem. We also show how to exploit Mercer kernels to extend M-4 for nonlinear classifications. Furthermore, we perform a series of evaluations on both synthetic data sets and real-world benchmark data sets. Comparison with SVM and MPM demonstrates the advantages of our new model.",10.1109/TNN.2007.905855,classification; kernel methods; large margin; learning locally and globally; second-order cone programming,,0.0,1.0
Multi-objective learning of hybrid classifiers,"Piltaver, R; Lustrek, M; Zupancic, J; Dzeroski, S; Gams, M",21ST EUROPEAN CONFERENCE ON ARTIFICIAL INTELLIGENCE (ECAI 2014),2014.0,"We propose a multi-objective machine learning approach guaranteed to find the Pareto optimal set of hybrid classification models consisting of comprehensible and incomprehensible submodels. The algorithm run-times are below 1 s for typical applications despite the exponential worst-case time complexity. The user chooses the model with the best comprehensibility-accuracy trade-off from the Pareto front which enables a well informed decision or repeats finding new Pareto fronts with modified seeds. For a classification trees as the comprehensible seed, the hybrids include single black-box model, invoked in hybrid leaves. The comprehensibility of such hybrid classifiers is measured with the proportion of examples classified by the regular leaves. We propose one simple and one computationally efficient algorithm for finding the Pareto optimal hybrid trees, starting from an initial classification tree and a black-box classifier. We evaluate the proposed algorithms empirically, comparing them to the baseline solution set, showing that they often provide valuable improvements. Furthermore, we show that the efficient algorithm outperforms the NSGA-II algorithm in terms of quality of the result set and efficiency (for this optimisation problem). Finally we show that the algorithm returns hybrid classifiers that reflect the expert's knowledge on activity recognition problem well.",10.3233/978-1-61499-419-0-717,,,0.0,1.0
Robust multiobjective evolutionary feature subset selection algorithm for binary classification using machine learning techniques,"Deniz, A; Kiziloz, HE; Dokeroglu, T; Cosar, A",NEUROCOMPUTING,2017.0,"This study investigates the success of a multiobjective genetic algorithm (GA) combined with state-of-the-art machine learning (ML) techniques for the feature subset selection (FSS) in binary classification problem (BCP). Recent studies have focused on improving the accuracy of BCP by including all of the features, neglecting to determine the best performing subset of features. However, for some problems, the number of features may reach thousands, which will cause too much computation power to be consumed during the feature evaluation and classification phases, also possibly reducing the accuracy of the results. Therefore, selecting the minimum number of features while preserving and/or increasing the accuracy of the results at a high level becomes an important issue for achieving fast and accurate binary classification. Our multiobjective evolutionary algorithm includes two phases, FSS using a GA and applying ML techniques for the BCP. Since exhaustively investigating all of the feature subsets is intractable, a GA is preferred for the first phase of the algorithm for intelligently detecting the most appropriate feature subset. The GA uses multiobjective crossover and mutation operators to improve a population of individuals (each representing a selected feature subset) and obtain (near-) optimal solutions through generations. In the second phase of the algorithms, the fitness of the selected subset is decided by using state-of-the-art ML techniques; Logistic Regression, Support Vector Machines, Extreme Learning Machine, K-means, and Affinity Propagation. The performance of the multiobjective evolutionary algorithm (and the ML techniques) is evaluated with comprehensive experiments and compared with state-of-the-art algorithms, Greedy Search, Particle Swarm Optimization, Tabu Search, and Scatter Search. The proposed algorithm was observed to be robust and it performed better than the existing methods on most of the datasets. (C) 2017 Elsevier B.V. All rights reserved.",10.1016/j.neucom.2017.02.033,Multiobjective feature selection; Evolutionary algorithm; Binary classification; Supervised/unsupervised machine learning,,0.0,1.0
Artificial chicken swarm algorithm for multi-objective optimization with deep learning,"Wei, QZ; Huang, DR; Zhang, Y",JOURNAL OF SUPERCOMPUTING,2021.0,"With the rapid development of computer hardware in the past three decades, various classic algorithms such as neural computing and bionic optimization computing have been widely used in practical problems. This paper extended the new bionic algorithm-flock algorithm proposed in 2014 and obtained a multi-objective flock algorithm to solve the multi-objective problem. This study used aggregate functions to define social ranks, and simulated the foraging behavior of chickens in the process of searching for food in the objective space and found the balance between diversity and convergence when looking for the best Pareto solution. The algorithm took five types of bi-objective functions and four types of three-objective functions as objects and compared it with four more widely used algorithms in multi-objective problems. The results demonstrate that the MOCSO (multi-objective chicken swarm optimization) algorithm shows better results in the optimization of multi-objective problems.",10.1007/s11227-021-03770-z,Neural computing; Bionic optimization calculation; Multi-objective optimization; Chicken swarm optimization algorithm; Pareto solution set; Deep learning,,0.0,1.0
LEARNING MODELS WITH UNIFORM PERFORMANCE VIA DISTRIBUTIONALLY ROBUST OPTIMIZATION,"Duchi, JC; Namkoong, H",ANNALS OF STATISTICS,2021.0,"A common goal in statistics and machine learning is to learn models that can perform well against distributional shifts, such as latent heterogeneous subpopulations, unknown covariate shifts or unmodeled temporal effects. We develop and analyze a distributionally robust stochastic optimization (DRO) framework that learns a model providing good performance against perturbations to the data-generating distribution. We give a convex formulation for the problem, providing several convergence guarantees. We prove finite-sample minimax upper and lower bounds, showing that distributional robustness sometimes comes at a cost in convergence rates. We give limit theorems for the learned parameters, where we fully specify the limiting distribution so that confidence intervals can be computed. On real tasks including generalizing to unknown subpopulations, fine-grained recognition and providing good tail performance, the distributionally robust approach often exhibits improved performance.",10.1214/20-AOS2004,Robust optimization; minimax optimality; risk-averse learning,,0.0,1.0
Robust randomized optimization with k nearest neighbors,"Reeve, HWJ; Kaban, A",ANALYSIS AND APPLICATIONS,2019.0,"Modern applications of machine learning typically require the tuning of a multitude of hyperparameters. With this motivation in mind, we consider the problem of optimization given a set of noisy function evaluations. We focus on robust optimization in which the goal is to find a point in the input space such that the function remains high when perturbed by an adversary within a given radius. Here we identify the minimax optimal rate for this problem, which turns out to be of order O(n(-lambda/(2 lambda+ 1))), where n is the sample size and lambda quantifies the smoothness of the function for a broad class of problems, including situations where the metric space is unbounded. The optimal rate is achieved (up to logarithmic factors) by a conceptually simple algorithm based on k-nearest neighbor regression.",10.1142/S0219530519400086,Optimization for machine learning; metric spaces; non-parametric methods,,0.0,1.0
A multi-objective evolutionary approach to training set selection for support vector machine,"Acampora, G; Herrera, F; Tortora, G; Vitiello, A",KNOWLEDGE-BASED SYSTEMS,2018.0,"The Support Vector Machine (SVM) is one of the most powerful algorithms for machine learning and data mining in numerous and heterogenous application domains. However, in spite of its competitiveness, SVM suffers from scalability problems which drastically worsens its performance in terms of memory requirements and execution time. As a consequence, there is a strong emergence of approaches for supporting SVM in efficiently addressing the aforementioned problems without affecting its classification capabilities. In this scenario, methods for Training Set Selection (TSS) represent a suitable and consolidated pre-processing technique to compute a reduced but representative training dataset, and improve SVM's scalability without deprecating its classification accuracy. Recently, TSS has been formulated as an optimization problem characterized by two objectives (the classification accuracy and the reduction rate) and solved through the application of evolutionary algorithms. However, so far, all the evolutionary approaches for TSS have been based on a so-called multi-objective a priori technique, where multiple objectives are aggregated together into a single objective through a weighted combination. This paper proposes to apply, for the first time, a Pareto-based multi-objective optimization approach to the TSS problem in order to explicitly deal with both its objectives and offer a better trade-off between SVM's classification and reduction performance. The benefits of the proposed approach are validated by a set of experiments involving well-known datasets taken from the UCI Machine Learning Database Repository. As shown by statistical tests, the application of a Pareto-based multi-objective optimization approach improves on state-of-the-art TSS techniques and enhances SVM efficiency. (c) 2018 Elsevier B.V. All rights reserved.",10.1016/j.knosys.2018.02.022,Training set selection; Multi-objective optimization; Support vector machine,,0.0,1.0
MCR SVM classifier with group sparsity,"Liu, JW; Cui, LP; Luo, XL",OPTIK,2016.0,"Classification and dimensionality reduction of high-dimensional data are two important topics in bioinformatics, data mining and machine learning. We propose a novel sparse minimax concave ridge support vector machine (MCR SVM) classifier that simultaneously performs classification and dimensionality reduction. The MCR SVM classifier proposed in this study combines the advantages of the unbiasedness of the estimators of the SCAD SVM and the ability of feature group selection of HHSVM to overcome the disadvantages. We also provide a theoretical justification for the group sparsity of the selected features. The experiments on artificial highly correlated data and high-dimensional real-world data with a small sample size show that the MCR SVM classifier is a attractive technique of classification and dimensionality reduction and its performance is better than the other sparse SVMs. (C) 2016 Elsevier GmbH. All rights reserved.",10.1016/j.ijleo.2016.03.060,Sparsity; Feature selection; Group feature selection; MCR penalty; MCR SVM,,0.0,1.0
Learning comprehensible and accurate hybrid trees,"Piltaver, R; Lustrek, M; Dzeroski, S; Gjoreski, M; Gams, M",EXPERT SYSTEMS WITH APPLICATIONS,2021.0,"Finding the best classifiers according to different criteria is often performed by a multi-objective machine learning algorithm. This study considers two criteria that are usually treated as the most important when deciding which classifier to apply in practice: comprehensibility and accuracy. A model that offers a broad range of trade-offs between the two criteria is introduced because they conflict; i.e., increasing one decreases the other. The choice of the model is motivated by the fact that domain experts often formalize decisions based on knowledge that can be represented by comprehensible rules and some tacit knowledge. This approach is mimicked by a hybrid tree that consists of comprehensible parts that originate from a regular classification tree and incomprehensible parts that originate from an accurate black-box classifier. An empirical evaluation on 23 UCI datasets shows that the hybrid trees provide trade-offs between the accuracy and comprehensibility that are not possible using traditional machine learning models. A corresponding hybrid-tree comprehensibility metric is also proposed. Furthermore, the paper presents a novel algorithm for learning MAchine LeArning Classifiers with HybrId TrEes (MALACHITE), and it proves that the algorithm finds a complete set of nondominated hybrid trees with regard to their accuracy and comprehensibility. The algorithm is shown to be faster than the well-known multi-objective evolutionary optimization algorithm NSGA-II for trees with moderate size, which is a prerequisite for comprehensibility. On the other hand, the MALACHITE algorithm can generate considerably larger hybrid-trees than a naive exhaustive search algorithm in a reasonable amount of time. In addition, an interactive iterative data mining process based on the algorithm is proposed that enables inspection of the Pareto set of hybrid trees. In each iteration, the domain expert analyzes the current set of nondominated hybrid trees, infers domain relations, and sets the parameters for the next machine learning step accordingly.",10.1016/j.eswa.2020.113980,Hybrid tree; Multi-objective learning; Comprehensibility; Accuracy; Classification,,0.0,1.0
High Dimensional Restrictive Federated Model Selection with Multi-objective Bayesian Optimization over Shifted Distributions,"Sun, XD; Bommert, A; Pfisterer, F; Rahenfurher, J; Lang, M; Bischl, B","INTELLIGENT SYSTEMS AND APPLICATIONS, VOL 1",2020.0,"A novel machine learning optimization process coined Restrictive Federated Model Selection (RFMS) is proposed under the scenario, for example, when data from healthcare units can not leave the site it is situated on and it is forbidden to carry out training algorithms on remote data sites due to either technical or privacy and trust concerns. To carry out a clinical research in this scenario, an analyst could train a machine learning model only on local data site, but it is still possible to execute a statistical query at a certain cost in the form of sending a machine learning model to some of the remote data sites and get the performance measures as feedback, maybe due to prediction being usually much cheaper. Compared to federated learning, which is optimizing the model parameters directly by carrying out training across all data sites, RFMS trains model parameters only on one local data site but optimizes hyper parameters across other data sites jointly since hyper-parameters play an important role in machine learning performance. The aim is to get a Pareto optimal model with respective to both local and remote unseen prediction losses, which could generalize well across data sites. In this work, we specifically consider high dimensional data with different distributions over data sites. As an initial investigation, Bayesian Optimization especially multi-objective Bayesian Optimization is used to guide an adaptive hyper-parameter optimization process to select models under the RFMS scenario. Empirical results shows that solely using the local data site to tune hyper-parameters generalizes poorly across data sites, compared to methods that utilize the local and remote performances. Furthermore, in terms of hypervolumes, multi-objective Bayesian Optimization algorithms show increased performance across multiple data sites among other candidates.",10.1007/978-3-030-29516-5_48,Federated learning; Multi-objective Bayesian Optimization; High dimensional data; Differential privacy; Distribution shift; Model selection,,0.0,1.0
SPRINT Multi-Objective Model Racing,"Zhang, TT; Georgiopoulos, M; Anagnostopoulos, GC",GECCO'15: PROCEEDINGS OF THE 2015 GENETIC AND EVOLUTIONARY COMPUTATION CONFERENCE,2015.0,"Multi-objective model selection, which is an important aspect of Machine Learning, refers to the problem of identifying a set of Pareto optimal models from a given ensemble of models. This paper proposes SPRINT-Race, a multi-objective racing algorithm based on the Sequential Probability Ratio Test with an Indifference Zone. In SPRINT-Race, a non-parametric ternary-decision sequential analogue of the sign test is adopted to identify pair-wise dominance and non-dominance relationship. In addition, a Bonferroni approach is employed to control the overall probability of any erroneous decisions. In the fixed confidence setting, SPRINT-Race tries to minimize the computational effort needed to achieve a predefined confidence about the quality of the returned models. The efficiency of SPRTNT-Race is analyzed on artificially-constructed multi-objective model selection problems with known ground-truth. Moreover, SPRINT-Race is applied to identifying the Pareto optimal parameter settings of Ant Colony Optimization algorithms in the context of solving Traveling Salesman Problems. The experimental results confirm the advantages of SPRINT-Race for multi-objective model selection.",10.1145/2739480.2754791,Racing Algorithm; Model Selection; Multi-objective Optimization; Sequential Probability Ratio Test,,0.0,1.0
A Method for Entity Resolution in High Dimensional Data Using Ensemble Classifiers,"Liu, Y; Diao, XC; Cao, JJ; Zhou, X; Shang, YL",MATHEMATICAL PROBLEMS IN ENGINEERING,2017.0,"In order to improve utilization rate of high dimensional data features, an ensemble learning method based on feature selection for entity resolution is developed. Entity resolution is regarded as a binary classification problem, an optimization model is designed to maximize each classifier's classification accuracy and dissimilarity between classifiers and minimize cardinality of features. A modified multiobjective ant colony optimization algorithm is employed to solve the model for each base classifier, two pheromone matrices are set up, weighted product method is applied to aggregate values of two pheromone matrices, and feature's Fisher discriminant rate of records' similarity vector is calculated as heuristic information. A solution which is called complementary subset is selected from Pareto archive according to the descending order of three objectives to train the given base classifier. After training all base classifiers, their classification outputs are aggregated by max-wins voting method to obtain the ensemble classifiers' final result. A simulation experiment is carried out on three classical datasets. The results show the effectiveness of our method, as well as a better performance compared with the other two methods.",10.1155/2017/4953280,,,0.0,1.0
A projection multi-objective SVM method for multi-class classification,"Liu, L; Martin-Barragan, B; Prieto, FJ",COMPUTERS & INDUSTRIAL ENGINEERING,2021.0,"Support Vector Machines (SVMs), originally proposed for classifications of two classes, have become a very popular technique in the machine learning field. For multi-class classifications, various single-objective models and multi-objective ones have been proposed. However,in most single-objective models, neither the different costs of different misclassifications nor the users' preferences were considered. This drawback has been taken into account in multi-objective models. In these models, large and hard second-order cone programs(SOCPs) were constructed ane weakly Pareto-optimal solutions were offered. In this paper, we propose a Projected Multi-objective SVM (PM), which is a multi-objective technique that works in a higher dimensional space than the object space. For PM, we can characterize the associated Pareto-optimal solutions. Additionally, it significantly alleviates the computational bottlenecks for classifications with large numbers of classes. From our experimental results, we can see PM outperforms the single-objective multi-class SVMs (based on an all-together method, one-against-all method and one-against-one method) and other multi-objective SVMs. Compared to the single-objective multi-class SVMs, PM provides a wider set of options designed for different misclassifications, without sacrificing training time. Compared to other multi-objective methods, PM promises the out-of-sample quality of the approximation of the Pareto frontier, with a considerable reduction of the computational burden.",10.1016/j.cie.2021.107425,Multiple objective programming; Support vector machine; Multi-class multi-objective SVM; Pareto-optimal solution,,0.0,1.0
