Title,Authors,Publisher,Year,Abstract,DOI,Keywords,Citations,Remove - Title,Second Filter
REPAIR: Removing Representation Bias by Dataset Resampling,Y. Li; N. Vasconcelos,2019 IEEE/CVF Conference on Computer Vision and Pattern Recognition (CVPR),2019.0,"Modern machine learning datasets can have biases for certain representations that are leveraged by algorithms to achieve high performance without learning to solve the underlying task. This problem is referred to as “representation bias”. The question of how to reduce the representation biases of a dataset is investigated and a new dataset REPresentAtion bIas Removal (REPAIR) procedure is proposed. This formulates bias minimization as an optimization problem, seeking a weight distribution that penalizes examples easy for a classifier built on a given feature representation. Bias reduction is then equated to maximizing the ratio between the classification loss on the reweighted dataset and the uncertainty of the ground-truth class labels. This is a minimax problem that REPAIR solves by alternatingly updating classifier parameters and dataset resampling weights, using stochastic gradient descent. An experimental set-up is also introduced to measure the bias of any dataset for a given representation, and the impact of this bias on the performance of recognition models. Experiments with synthetic and action recognition data show that dataset REPAIR can significantly reduce representation bias, and lead to improved generalization of models trained on REPAIRed datasets. The tools used for characterizing representation bias, and the proposed dataset REPAIR algorithm, are available at https://github.com/JerryYLi/Dataset-REPAIR/.",10.1109/CVPR.2019.00980,Datasets and Evaluation;Action Recognition ; Deep Learning ; Representation Learning; Video Analytics,29.0,0.0,1.0
Variational Bound of Mutual Information for Fairness in Classification,Z. Alsulaimawi,2020 IEEE 22nd International Workshop on Multimedia Signal Processing (MMSP),2020.0,"Machine learning applications have emerged in many aspects of our lives, such as for credit lending, insurance rates, and employment applications. Consequently, it is required that such systems be nondiscriminatory and fair in sensitive features user, e.g., race, sexual orientation, and religion. To address this issue, this paper develops a minimax adversarial framework, called features protector (FP) framework, to achieve the information-theoretical trade-off between minimizing distortion of target data and ensuring that sensitive features have similar distributions. We evaluate the performance of the proposed framework on two real-world datasets. Preliminary empirical evaluation shows that our framework provides both accurate and fair decisions.",10.1109/MMSP48831.2020.9287139,Fairness;privacy-preserving;adversarial learning;variational mutual information;big data security;deep learning,,0.0,1.0
Pruning In Time (PIT): A Lightweight Network Architecture Optimizer for Temporal Convolutional Networks,M. Risso; A. Burrello; D. J. Pagliari; F. Conti; L. Lamberti; E. Macii; L. Benini; M. Poncino,2021 58th ACM/IEEE Design Automation Conference (DAC),2021.0,"Temporal Convolutional Networks (TCNs) are promising Deep Learning models for time-series processing tasks. One key feature of TCNs is time-dilated convolution, whose optimization requires extensive experimentation. We propose an automatic dilation optimizer, which tackles the problem as a weight pruning on the time-axis, and learns dilation factors together with weights, in a single training. Our method reduces the model size and inference latency on a real SoC hardware target by up to 7.4× and 3×, respectively with no accuracy drop compared to a network without dilation. It also yields a rich set of Pareto-optimal TCNs starting from a single model, outperforming hand-designed solutions in both size and accuracy.",10.1109/DAC18074.2021.9586187,Neural Architecture Search;Temporal Convolutional Networks;Edge Computing;Deep Learning,1.0,0.0,1.0
Transfer Learning for Design-Space Exploration with High-Level Synthesis,J. Kwon; L. P. Carloni,2020 ACM/IEEE 2nd Workshop on Machine Learning for CAD (MLCAD),2020.0,"High-level synthesis (HLS) raises the level of design abstraction, expedites the process of hardware design, and enriches the set of final designs by automatically translating a behavioral specification into a hardware implementation. To obtain different implementations, HLS users can apply a variety of knobs, such as loop unrolling or function inlining, to particular code regions of the specification. The applied knob configuration significantly affects the synthesized design's performance and cost, e.g., application latency and area utilization. Hence, HLS users face the design-space exploration (DSE) problem, i.e. determine which knob configurations result in Pareto-optimal implementations in this multi-objective space. Whereas it can be costly in time and resources to run HLS flows with an enormous number of knob configurations, machine learning approaches can be employed to predict the performance and cost. Still, they require a sufficient number of sample HLS runs. To enhance the training performance and reduce the sample complexity, we propose a transfer learning approach that reuses the knowledge obtained from previously explored design spaces in exploring a new target design space. We develop a novel neural network model for mixed-sharing multi-domain transfer learning. Experimental results demonstrate that the proposed model outperforms both single-domain and hard-sharing models in predicting the performance and cost at early stages of HLS-driven DSE.",10.1145/3380446.3430636,high-level synthesis;design space exploration;neural networks;machine learning;transfer learning;multi-task learning,4.0,0.0,1.0
Discovering Knowledge Rules with Multi-Objective Evolutionary Computing,R. Giusti; G. E. A. P. A. Batista,2010 Ninth International Conference on Machine Learning and Applications,2010.0,"Most Machine Learning systems target into inducing classifiers with optimal coverage and precision measures. Although this constitutes a good approach for prediction, it might not provide good results when the user is more interested in description. In this case, the induced models should present other properties such as novelty, interestingness and so forth. In this paper we present a research work based in Multi-Objective Evolutionary Computing to construct individual knowledge rules targeting arbitrary user-defined criteria via objective quality measures such as precision, support, novelty etc. This paper also presents a comparison among multi-objective and ranking composition techniques. It is shown that multi-objective-based methods attain better results than ranking-based methods, both in terms of solution dominance and diversity of solutions in the Pareto front.",10.1109/ICMLA.2010.25,Multi-Objective Machine Learning;Knowledge Discovery in Databases;Evolutionary Computing,,0.0,1.0
Autonomous Virulence Adaptation Improves Coevolutionary Optimization,J. Cartlidge; D. Ait-Boudaoud,IEEE Transactions on Evolutionary Computation,2011.0,"A novel approach for the autonomous virulence adaptation (AVA) of competing populations in a coevolutionary optimization framework is presented. Previous work has demonstrated that setting an appropriate virulence, v, of populations accelerates coevolutionary optimization by avoiding detrimental periods of disengagement. However, since the likelihood of disengagement varies both between systems and over time, choosing the ideal value of v is problematic. The AVA technique presented here uses a machine learning approach to continuously tune v as system engagement varies. In a simple, abstract domain, AVA is shown to successfully adapt to the most productive values of v. Further experiments, in more complex domains of sorting networks and maze navigation, demonstrate AVA's efficiency over reduced virulence and the layered Pareto coevolutionary archive.",10.1109/TEVC.2010.2073471,Autonomous virulence adaptation;coevolution;disengagement;genetic algorithms;machine learning;maze navigation;optimization methods;reduced virulence;sorting networks,6.0,0.0,1.0
Heuristically-Accelerated Multiagent Reinforcement Learning,R. A. C. Bianchi; M. F. Martins; C. H. C. Ribeiro; A. H. R. Costa,IEEE Transactions on Cybernetics,2014.0,"This paper presents a novel class of algorithms, called Heuristically-Accelerated Multiagent Reinforcement Learning (HAMRL), which allows the use of heuristics to speed up well-known multiagent reinforcement learning (RL) algorithms such as the Minimax-Q. Such HAMRL algorithms are characterized by a heuristic function, which suggests the selection of particular actions over others. This function represents an initial action selection policy, which can be handcrafted, extracted from previous experience in distinct domains, or learnt from observation. To validate the proposal, a thorough theoretical analysis proving the convergence of four algorithms from the HAMRL class (HAMMQ, HAMQ(λ), HAMQS, and HAMS) is presented. In addition, a comprehensive systematical evaluation was conducted in two distinct adversarial domains. The results show that even the most straightforward heuristics can produce virtually optimal action selection policies in much fewer episodes, significantly improving the performance of the HAMRL over vanilla RL algorithms.",10.1109/TCYB.2013.2253094,Artificial intelligence;heuristic algorithms;machine learning;multiagent systems,53.0,0.0,1.0
On Stabilizing Generative Adversarial Training With Noise,S. Jenni; P. Favaro,2019 IEEE/CVF Conference on Computer Vision and Pattern Recognition (CVPR),2019.0,"We present a novel method and analysis to train generative adversarial networks (GAN) in a stable manner. As shown in recent analysis, training is often undermined by the probability distribution of the data being zero on neighborhoods of the data space. We notice that the distributions of real and generated data should match even when they undergo the same filtering. Therefore, to address the limited support problem we propose to train GANs by using different filtered versions of the real and generated data distributions. In this way, filtering does not prevent the exact matching of the data distribution, while helping training by extending the support of both distributions. As filtering we consider adding samples from an arbitrary distribution to the data, which corresponds to a convolution of the data distribution with the arbitrary one. We also propose to learn the generation of these samples so as to challenge the discriminator in the adversarial training. We show that our approach results in a stable and well-behaved training of even the original minimax GAN formulation. Moreover, our technique can be incorporated in most modern GAN formulations and leads to a consistent improvement on several common datasets.",10.1109/CVPR.2019.01242,Image and Video Synthesis;Deep Learning,6.0,0.0,1.0
Partially Adversarial Learning and Adaptation,J. -T. Chien; Y. -Y. Lyu,2019 27th European Signal Processing Conference (EUSIPCO),2019.0,"An image classification system for a specific target domain is usually trained with initialization from a source domain given with a large number of classes, particularly in an application of image recognition. The classes in target domain are usually seen as a subset in source domain. Partial domain adaptation aims to tackle this generalization issue where no labeled data are provided in target domain. This paper presents an adversarial learning for partial domain adaptation where a symmetric metric based on the Wasserstein distance is adopted in an adversarial learning objective. We build a Wasserstein partial transfer network where the Wasserstein adversarial objective is jointly optimized to partially transfer the relevance knowledge from source to target domains. The geometric property for optimal transport is assured to mitigate the gradient vanishing problem in adversarial training. The neural network components for feature extraction, relevance transfer, domain matching and task classification are jointly trained by solving a minimax optimization over multiple objectives. Experiments on image classification show the merits of the proposed partially adversarial domain adaptation over different tasks.",10.23919/EUSIPCO.2019.8903147,image classification;domain adaptation;deep learning;adversarial learning;partial transfer,5.0,0.0,1.0
Transferable Representation Learning with Deep Adaptation Networks,M. Long; Y. Cao; Z. Cao; J. Wang; M. I. Jordan,IEEE Transactions on Pattern Analysis and Machine Intelligence,2019.0,"Domain adaptation studies learning algorithms that generalize across source domains and target domains that exhibit different distributions. Recent studies reveal that deep neural networks can learn transferable features that generalize well to similar novel tasks. However, as deep features eventually transition from general to specific along the network, feature transferability drops significantly in higher task-specific layers with increasing domain discrepancy. To formally reduce the effects of this discrepancy and enhance feature transferability in task-specific layers, we develop a novel framework for deep adaptation networks that extends deep convolutional neural networks to domain adaptation problems. The framework embeds the deep features of all task-specific layers into reproducing kernel Hilbert spaces (RKHSs) and optimally matches different domain distributions. The deep features are made more transferable by exploiting low-density separation of target-unlabeled data in very deep architectures, while the domain discrepancy is further reduced via the use of multiple kernel learning that enhances the statistical power of kernel embedding matching. The overall framework is cast in a minimax game setting. Extensive empirical evidence shows that the proposed networks yield state-of-the-art results on standard visual domain-adaptation benchmarks.",10.1109/TPAMI.2018.2868685,Domain adaptation;deep learning;convolutional neural network;two-sample test;multiple kernel learning,120.0,0.0,1.0
Unsupervised Visual Domain Adaptation: A Deep Max-Margin Gaussian Process Approach,M. Kim; P. Sahu; B. Gholami; V. Pavlovic,2019 IEEE/CVF Conference on Computer Vision and Pattern Recognition (CVPR),2019.0,"For unsupervised domain adaptation, the target domain error can be provably reduced by having a shared input representation that makes the source and target domains indistinguishable from each other. Very recently it has been shown that it is not only critical to match the marginal input distributions, but also align the output class distributions. The latter can be achieved by minimizing the maximum discrepancy of predictors. In this paper, we take this principle further by proposing a more systematic and effective way to achieve hypothesis consistency using Gaussian processes (GP). The GP allows us to induce a hypothesis space of classifiers from the posterior distribution of the latent random functions, turning the learning into a large-margin posterior separation problem, significantly easier to solve than previous approaches based on adversarial minimax optimization. We formulate a learning objective that effectively influences the posterior to minimize the maximum discrepancy. This is shown to be equivalent to maximizing margins and minimizing uncertainty of the class predictions in the target domain. Empirical results demonstrate that our approach leads to state-to-the-art performance superior to existing methods on several challenging benchmarks for domain adaptation.",10.1109/CVPR.2019.00451,Deep Learning;Recognition: Detection;Categorization;Retrieval; Statistical Learning,16.0,0.0,1.0
Leveraging the Invariant Side of Generative Zero-Shot Learning,J. Li; M. Jing; K. Lu; Z. Ding; L. Zhu; Z. Huang,2019 IEEE/CVF Conference on Computer Vision and Pattern Recognition (CVPR),2019.0,"Conventional zero-shot learning (ZSL) methods generally learn an embedding, e.g., visual-semantic mapping, to handle the unseen visual samples via an indirect manner. In this paper, we take the advantage of generative adversarial networks (GANs) and propose a novel method, named leveraging invariant side GAN (LisGAN), which can directly generate the unseen features from random noises which are conditioned by the semantic descriptions. Specifically, we train a conditional Wasserstein GANs in which the generator synthesizes fake unseen features from noises and the discriminator distinguishes the fake from real via a minimax game. Considering that one semantic description can correspond to various synthesized visual samples, and the semantic description, figuratively, is the soul of the generated features, we introduce soul samples as the invariant side of generative zero-shot learning in this paper. A soul sample is the meta-representation of one class. It visualizes the most semantically-meaningful aspects of each sample in the same category. We regularize that each generated sample (the varying side of generative ZSL) should be close to at least one soul sample (the invariant side) which has the same class label with it. At the zero-shot recognition stage, we propose to use two classifiers, which are deployed in a cascade way, to achieve a coarse-to-fine result. Experiments on five popular benchmarks verify that our proposed approach can outperform state-of-the-art methods with significant improvements.",10.1109/CVPR.2019.00758,Recognition: Detection;Categorization;Retrieval;Deep Learning ; Image and Video Synthesis,62.0,0.0,1.0
Automatic Decision Making for Parameters in Kernel Method,Y. Pei,2019 IEEE Symposium Series on Computational Intelligence (SSCI),2019.0,"We propose to use the relationship between the parameter of kernel function and its decisional angle or distance metrics for selecting the optimal setting of the parameter of kernel functions in kernel method-based algorithms. Kernel method is established in the reproducing kernel Hilbert space, the angle and distance are two metrics in such space. We analyse and investigate the relationship between the parameter of kernel function and the metrics (distance or angle) in the reproducing kernel Hilbert space. We design a target function of optimization to model the relationship between these two variables, and found that (1) the landscape shapes of parameter and the metrics are the same in Gaussian kernel function because the norm of all the vectors are equal to one in reproducing kernel Hilbert space; (2) the landscape monotonicity of that are opposite in polynomial kernel function from that of Gaussian kernel. The monotonicity of designed target functions of optimization using Gaussian kernel and polynomial kernel is different as well. The distance metric and angle metric have different distribution characteristics for the decision of parameter setting in kernel function. It needs to balance these two metrics when selecting a proper parameter of the kernel function in kernel-based algorithms. We use evolutionary multi-objective optimization algorithms to obtain the Pareto solutions for optimal selection of the parameter in kernel functions. We found that evolutionary multi-objective optimization algorithms are useful tools to balance the distance metric and angle metric in the decision of parameter setting in kernel method-based algorithms.",10.1109/SSCI44817.2019.9002691,kernel method;kernel function;reproducing kernel Hilbert space;machine learning;decision making;evolutionary multi-objective optimization,2.0,0.0,1.0
Fast and Accurate PPA Modeling with Transfer Learning,W. R. Davis; P. Franzon; L. Francisco; B. Huggins; R. Jain,2021 IEEE/ACM International Conference On Computer Aided Design (ICCAD),2021.0,"The power, performance and area (PPA) of digital blocks can vary 10:1 based on their synthesis, place, and route tool recipes. With rapid increase in number of PVT corners and complexity of logic functions approaching 10M gates, industry has an acute need to minimize the human resources, compute servers, and EDA licenses needed to achieve a Pareto optimal recipe. We first present models for fast accurate PPA prediction that can reduce the manual optimization iterations with EDA tools. Secondly we investigate techniques to automate the PPA optimization using evolutionary algorithms. For PPA prediction, a baseline model is trained on a known design using Latin hypercube sample runs of the EDA tool, and transfer learning is then used to train the model for an unseen design. For a known design the baseline needed 150 training runs to achieve a 95% accuracy. With transfer learning the same accuracy was achieved on a different (unseen) design in only 15 runs indicating the viability of transfer learning to generalize PPA models. The PPA optimization technique, based on evolutionary algorithms, effectively combines the PPA modeling and optimization. Our approach reached the same PPA solution as human designers in the same or fewer runs for a CORTEX-M0 system design. This shows potential for automating the recipe optimization without needing more runs than a human designer would need.",10.1109/ICCAD51958.2021.9643533,PPA;Machine Learning;Power;Performance;Area;Gradient Boost;Neural Network;Transfer Learning;Surrogate Modeling,,0.0,1.0
Multi-Objective Learning of Multi-Dimensional Bayesian Classifiers,J. D. Rodríguez; J. A. Lozano,2008 Eighth International Conference on Hybrid Intelligent Systems,2008.0,"Multi-dimensional classification is a generalization of supervised classification that considers more than one class variable to classify. In this paper we review the existing multi-dimensional Bayesian classifiers and introduce a new one: the KDB multi-dimensional classifier. Then we define different classification rules for multi-dimensional scope. Finally, we introduce a structural learning approach of a multi-dimensional Bayesian classifier based on the multi-objective evolutionary algorithm NSGA-II. The solution of the learning approach is a Pareto front representing different multi-dimensional classifiers and their accuracy values for the different classes, so a decision maker can easily choose the classifier which is more interesting for the particular problem and domain.",10.1109/HIS.2008.143,Machine Learning;multi-dimensional classification;Bayesian classifiers;multi-objective;NSGA-II,16.0,0.0,1.0
Distilling Optimal Neural Networks: Rapid Search in Diverse Spaces,B. Moons; P. Noorzad; A. Skliar; G. Mariani; D. Mehta; C. Lott; T. Blankevoort,2021 IEEE/CVF International Conference on Computer Vision (ICCV),2021.0,"Current state-of-the-art Neural Architecture Search (NAS) methods neither efficiently scale to multiple hardware platforms, nor handle diverse architectural search-spaces. To remedy this, we present DONNA (Distilling Optimal Neural Network Architectures), a novel pipeline for rapid, scalable and diverse NAS, that scales to many user scenarios. DONNA consists of three phases. First, an accuracy predictor is built using blockwise knowledge distillation from a reference model. This predictor enables searching across diverse networks with varying macro-architectural parameters such as layer types and attention mechanisms, as well as across micro-architectural parameters such as block repeats and expansion rates. Second, a rapid evolutionary search finds a set of pareto-optimal architectures for any scenario using the accuracy predictor and on-device measurements. Third, optimal models are quickly fine-tuned to training-from-scratch accuracy. DONNA is up to 100× faster than MNasNet in finding state-of-the-art architectures on-device. Classifying ImageNet, DONNA architectures are 20% faster than EfficientNet-B0 and Mo-bileNetV2 on a Nvidia V100 GPU and 10% faster with 0.5% higher accuracy than MobileNetV2-1.4x on a Samsung S20 smartphone. In addition to NAS, DONNA is used for search-space extension and exploration, as well as hardware-aware model compression.",10.1109/ICCV48922.2021.01201,Machine learning architectures and formulations; Efficient training and inference methods; Optimization and learning methods; Recognition and classification; Segmentation;grouping and shape,,0.0,1.0
