Title,Authors,Publisher,Year,Abstract,DOI,Keywords,Citations,Remove - Title,Second Filter
Single-Objective/Multiobjective Cat Swarm Optimization Clustering Analysis for Data Partition,D. Yan; H. Cao; Y. Yu; Y. Wang; X. Yu,IEEE Transactions on Automation Science and Engineering,2020.0,"This article proposes single-objective/multiobjective cat swarm optimization clustering algorithms for data partition. The proposed methods use the cat swarm to search the optimal. The position of the cat tightly associates with the clustering centers and is updated by two submodes: the seeking mode and the tracing mode. The seeking mode uses the simulated annealing strategy to update the cat position at a probability. Inspired by the quantum theories, the tracing mode adopts the quantum model to update the cat position in the whole solution space. First, the single-objective method is proposed and adopts the cohesion of clustering as the objective function, in which the kernel method is applied. For considering more objective functions to reveal diverse aspects of data, the multiobjective method is proposed and adopts both the cohesion and the connectivity as the objective functions. The Pareto optimization method is applied to balance the objectives. In the experiments, three kinds of data sets are used to examine the effectiveness of the proposed methods, which are three synthetic data sets, four data sets from the UCI Machine Learning Repository, and a field data set. Experimental results verified that the proposed methods perform better than the traditional clustering algorithms, and the proposed multiobjective method has the highest accuracy. Note to Practitioners-This article presents single-objective/multiobjective cat swarm optimization clustering analysis methods for data partition. Through automatically extracting meaningful or useful classes, clustering analysis could help the practitioners or the intelligent devices find the specific meanings of data, natural data structure, the data relationships, or other characteristics. The proposed methods use the cat swarm to search the optimal clustering result. One or more criterion functions could be selected as the optimization objectives. The time complexity of the multiobjective type is higher than that of the single-objective type. Therefore, in the industrial field, engineers should choose the number of the optimization objectives based on the actual requirements. The proposed methods could be widely used into industrial applications to deal with complex data sets. Future research could consider some more progressive optimization schemes to improve the effectiveness.",10.1109/TASE.2020.2969485,Clustering analysis;data partition;quantum model;single-objective/multiobjective optimization,9.0,0.0,1.0
Rotation effects of objective functions in parallel distributed multiobjective fuzzy genetics-based machine learning,Y. Takahashi; Y. Nojima; H. Ishibuchi,2015 10th Asian Control Conference (ASCC),2015.0,"Fuzzy genetics-based machine learning (FGBML) is one of data mining techniques using evolutionary computation. It can obtain fuzzy rule-based classifiers that are accurate and linguistically interpretable for human users. However, there are two major problems. One is that it is impossible to design the best classifier with respect to both accuracy and interpretability due to their tradeoff. To solve this problem, we proposed multiobjective FGBML (MoFGBML) where an evolutionary multiobjective optimization algorithm is used to obtain a number of classifiers with different tradeoffs between accuracy and complexity. The other is the heavy computational load of FGBML for large data sets. In the previous study, we applied parallel distributed implementation to our MoFGBML to overcome this problem. We examined the effects of the parallel distributed implementation on the search ability. Although the computational time became much shorter, the number of the obtained non-dominated classifiers became small. As a result, accurate classifiers were not obtained for some data sets. In this paper, we propose a simple idea to bias the search direction of our MoFGBML. We rotate one or two objective functions. This rotation changes the dominance relation in multiobjective optimization. Through computational experiments, we examine the effects of the rotated objective functions on the search ability of our MoFGBML for large data sets.",10.1109/ASCC.2015.7244890,Fuzzy genetics-based machine learning;parallel distributed implementation;multiobjective optimization,1.0,0.0,1.0
Multiple Reference Points-Based Decomposition for Multiobjective Feature Selection in Classification: Static and Dynamic Mechanisms,B. H. Nguyen; B. Xue; P. Andreae; H. Ishibuchi; M. Zhang,IEEE Transactions on Evolutionary Computation,2020.0,"Feature selection is an important task in machine learning that has two main objectives: 1) reducing dimensionality and 2) improving learning performance. Feature selection can be considered a multiobjective problem. However, it has its problematic characteristics, such as a highly discontinuous Pareto front, imbalance preferences, and partially conflicting objectives. These characteristics are not easy for existing evolutionary multiobjective optimization (EMO) algorithms. We propose a new decomposition approach with two mechanisms (static and dynamic) based on multiple reference points under the multiobjective evolutionary algorithm based on decomposition (MOEA/D) framework to address the above-mentioned difficulties of feature selection. The static mechanism alleviates the dependence of the decomposition on the Pareto front shape and the effect of the discontinuity. The dynamic one is able to detect regions in which the objectives are mostly conflicting, and allocates more computational resources to the detected regions. In comparison with other EMO algorithms on 12 different classification datasets, the proposed decomposition approach finds more diverse feature subsets with better performance in terms of hypervolume and inverted generational distance. The dynamic mechanism successfully identifies conflicting regions and further improves the approximation quality for the Pareto fronts.",10.1109/TEVC.2019.2913831,Classification;feature selection;multiobjective evolutionary algorithm based on decomposition (MOEA/D);multiobjective optimization;partially conflicting,23.0,0.0,1.0
Multiobjective Neural Network Ensembles Based on Regularized Negative Correlation Learning,H. Chen; X. Yao,IEEE Transactions on Knowledge and Data Engineering,2010.0,"Negative Correlation Learning (NCL) [CHECK END OF SENTENCE], [CHECK END OF SENTENCE] is a neural network ensemble learning algorithm which introduces a correlation penalty term to the cost function of each individual network so that each neural network minimizes its mean-square-error (MSE) together with the correlation. This paper describes NCL in detail and observes that the NCL corresponds to training the entire ensemble as a single learning machine that only minimizes the MSE without regularization. This insight explains that NCL is prone to overfitting the noise in the training set. The paper analyzes this problem and proposes the multiobjective regularized negative correlation learning (MRNCL) algorithm which incorporates an additional regularization term for the ensemble and uses the evolutionary multiobjective algorithm to design ensembles. In MRNCL, we define the crossover and mutation operators and adopt nondominated sorting algorithm with fitness sharing and rank-based fitness assignment. The experiments on synthetic data as well as real-world data sets demonstrate that MRNCL achieves better performance than NCL, especially when the noise level is nontrivial in the data set. In the experimental discussion, we give three reasons why our algorithm outperforms others.",10.1109/TKDE.2010.26,Multiobjective algorithm;multiobjective learning;neural network ensembles;neural networks;negative correlation learning;regularization.,83.0,0.0,1.0
Feature Selection Using Multiobjective Optimization for Named Entity Recognition,A. Ekbal; S. Saha; C. S. Garbe,2010 20th International Conference on Pattern Recognition,2010.0,"Appropriate feature selection is a very crucial issue in any machine learning framework, specially in Maximum Entropy (ME). In this paper, the selection of appropriate features for constructing a ME based Named Entity Recognition (NER) system is posed as a multiobjective optimization (MOO) problem. Two classification quality measures, namely recall and precision are simultaneously optimized using the search capability of a popular evolutionary MOO technique, NSGA-II. The proposed technique is evaluated to determine suitable feature combinations for NER in two languages, namely Bengali and English that have significantly different characteristics. Evaluation results yield the recall, precision and F-measure values of 70.76%, 81.88% and 75.91%, respectively for Bengali, and 78.38%, 81.27% and 79.80%, respectively for English. Comparison with an existing ME based NER system shows that our proposed feature selection technique is more efficient than the heuristic based feature selection.",10.1109/ICPR.2010.477,Multiobjective Optimization;Feature Selection;Maximum Entropy;Named Entity Recognition,17.0,0.0,1.0
Search ability of evolutionary multiobjective optimization algorithms for multiobjective fuzzy genetics-based machine learning,H. Ishibuchi; Y. Nakashima; Y. Nojima,2009 IEEE International Conference on Fuzzy Systems,2009.0,"Recently evolutionary multiobjective optimization (EMO) algorithms have been actively used for the design of accurate and interpretable fuzzy rule-based systems. This research area is often referred to as multiobjective genetic fuzzy systems where EMO algorithms are used to search for a number of non-dominated fuzzy rule-based systems with respect to their accuracy and interpretability. The main advantage of the use of EMO algorithms for fuzzy system design over single-objective optimizers is that multiple alternative fuzzy rule-based systems with different accuracy-interpretability tradeoffs are obtained by their single run. The decision maker can choose a single fuzzy rule-based system according to their preference. There still exist several important issues to be discussed in this research area such as the definition of interpretability, the formulation of interpretability measures, the visualization of tradeoff relations, and the interpretability of the explanation of fuzzy reasoning results. In this paper, we discuss the ability of EMO algorithms as multiobjective optimizers to search for Pareto optimal or near Pareto optimal fuzzy rule-based systems. More specifically, we examine whether EMO algorithms can find non-dominated fuzzy rule-based systems that approximate the entire Pareto fronts of multiobjective fuzzy system design problems.",10.1109/FUZZY.2009.5277370,,6.0,0.0,1.0
A Selective Ensemble Classifier Using Multiobjective Optimization Based Extreme Learning Machine Algorithm,L. Bai; H. Li; W. Gao,2021 17th International Conference on Computational Intelligence and Security (CIS),2021.0,"In a single hidden layer feedforward neural network (SLFN), acquiring optimal values for the number of hidden neurons and connection parameters simultaneously is regarded as one of challenges, which has attracted extensive attention. This is because changing the number of hidden neurons and connection parameters greatly affect overall performance of the SLFN and increase the training complexity. In this article, the training error, validation error, and network complexity are treated as three conflicting objectives of multiobjective model for getting a compact network with good generalization ability. For solving the multiobjective model, a hybrid coding scheme is designed for network structure and connection parameters of a SLFN, and then a multiobjective optimization based extreme learning machine (MOELM) is proposed for structure learning and parameter optimization simultaneously. To improve recognition accuracy, a selective ensemble classifier with three base classifiers according to the selection strategy is utilized to make final decision. Experimental results and comparison with other classifiers on several benchmark classification problems indicate the effectiveness and superiority of the proposed MOELM.",10.1109/CIS54983.2021.00017,feedforward neural network;extreme learning machine;multiobjective optimization;ensemble learning;classification,,0.0,1.0
Multiobjective fuzzy genetics-based machine learning with a reject option,Y. Nojima; H. Ishibuchi,2016 IEEE International Conference on Fuzzy Systems (FUZZ-IEEE),2016.0,"Classifier design for a classification problem with M classes can be viewed as finding an optimal partition of its pattern space into M disjoint subspaces. However, this is not always a good strategy especially when training patterns from different classes are heavily overlapping in the pattern space. A simple but practically useful idea is the use of a reject option. In this case, the pattern space is partitioned into (M+1) disjoint subspace where the classification of new patterns is rejected in the (M+1)th subspace. In this paper, we discuss the design of fuzzy rule-based classifiers with a reject option. The rejection subspace is specified by a threshold value for the difference of a kind of matching degrees between the best matching class and the second best matching class. The important research question is how to specify the threshold value. We examine the following two approaches: One is manual specification after designing a fuzzy rule-based classifier, and the other is simultaneous multiobjective optimization of a threshold value and a fuzzy rule-based classifier. In the latter approach, we use three objectives: maximization of the correct classification, and minimization of the rejection and the complexity of the classifier.",10.1109/FUZZ-IEEE.2016.7737854,Fuzzy genetics-based machine learning;reject option;evolutionary multiobjective optimization,1.0,0.0,1.0
Determination of Weights for Multiobjective Decision Making or Machine Learning,P. Wang; H. Zhu; M. Wilamowska-Korsak; Z. Bi; L. Li,IEEE Systems Journal,2014.0,"Decision-making processes in complex systems generally require the mechanisms to make the tradeoff among contradicting design criteria. When multiple objectives are involved in decision making or machine learning, a crucial step is to determine the weights of individual objectives to the system-level performance. Determining the weights of multiobjectives is an evaluation process, and it has been often treated as an optimization problem. However, our preliminary investigation has shown that existing methodologies in dealing with the weights of multiobjectives have some obvious limitations in the sense that the determination of weights is tackled as a single optimization problem, a result based on such an optimization is incomprehensive, and it can even be unreliable when the information about multiple objectives is incomplete such as an incompleteness caused by poor data. The constraints of weights are also discussed. Variable weights are natural in decision-making processes. Therefore, we are motivated to develop a systematic methodology in determining variable weights of multiobjectives. The roles of weights in an original multiobjective decision-making or machine-learning problem are analyzed, and the weights are determined with the aid of a modular neural network. The inconsistency issue of weights is particularly discussed.",10.1109/JSYST.2013.2265663,Consistency;multidisciplinary design optimization (MDO);multifunctional machine learning (MFML);multiobjective decision making (MODM);neural network;tradeoff;variable weights,12.0,0.0,1.0
An Entropy Driven Multiobjective Particle Swarm Optimization Algorithm for Feature Selection,J. Luo; D. Zhou; L. Jiang; H. Ma,2021 IEEE Congress on Evolutionary Computation (CEC),2021.0,"Feature selection is an important research field in machine learning since high-dimensionality is a common characteristic of real-world data. It has two main objectives, which are to maximize the classification accuracy while minimizing the number of selected features. As the two objectives are usually in conflict with each other, it makes feature selection a multi-objective problem. However, the large search space and discrete Pareto front makes it not easy for existing evolutionary multi-objective algorithms. In order to deal with the above mentioned difficulties in feature selection, an entropy driven multiobjective particle swarm optimization algorithm is proposed to remove redundant feature and decrease computational complexity. First, its basic idea is to model feature selection as a multiobjective optimization problem by optimizing the number of features and the classification accuracy in supervised condition simultaneously. Second, a particle initialization strategy based on information entropy is designed to improve the quality of initial solutions, and an adaptive velocity update rule is used to swap between local search and global search. Besides, a specified discrete nondominated sorting is designed. These strategies enable the proposed algorithm to gain better performance on both the quality and size of feature subset. The experimental results show that the proposed algorithm can maintain or improve the quality of Pareto fronts evolved by the state-of-the-art algorithms for feature selection.",10.1109/CEC45853.2021.9504837,feature selection;multiobjective optimization;particle swarm optimization,1.0,0.0,1.0
Model-based multiobjective fuzzy control using a new multiobjective dynamic programming approach,Dong-Oh Kang; Zeungnam Bien,Proceedings Joint 9th IFSA World Congress and 20th NAFIPS International Conference (Cat. No. 01TH8569),2001.0,"The authors propose a model-based multiobjective fuzzy control method which is optimized online via a novel multiobjective dynamic programming. The new multiobjective dynamic programming is guaranteed to derive a Pareto optimal solution. To estimate the effect of each candidate for control input in the dynamic programming procedure, we use state-value predictors of multiple objectives based on the plant model. Temporal difference learning and supervised learning are used for update of the predictors and the plant model. As the learning proceeds, the proposed method derives the compromised solution among multiple objectives. To show the effectiveness of the proposed method, some simulation results are given.",10.1109/NAFIPS.2001.943752,,1.0,0.0,1.0
Effects of the Use of Multiple Fuzzy Partitions on the Search Ability of Multiobjective Fuzzy Genetics-Based Machine Learning,Y. Nojima; Y. Nakashima; H. Ishibuchi,2009 International Conference of Soft Computing and Pattern Recognition,2009.0,"An important issue in the design of fuzzy rule-based systems is to find a good accuracy-complexity tradeoff. While simple fuzzy systems with high interpretability are usually not accurate, complicated fuzzy systems with high accuracy are usually not interpretable. Recently evolutionary multiobjective optimization (EMO) algorithms have been used to search for simple and accurate fuzzy systems. The main advantage of EMO-based approaches over single-objective techniques is that a number of alternative fuzzy systems with different accuracy-complexity tradeoffs can be obtained by their single run. We have already proposed a multiobjective fuzzy genetics-based machine learning (GBML) algorithm for pattern classification problems. In our GBML algorithm, multiple fuzzy partitions with different granularities are simultaneously used. This is because we usually do not know an appropriate fuzzy partition for each input variable. However, the use of multiple fuzzy partitions significantly increases the size of the search space. In this paper, we examine the effect of the use of multiple fuzzy partitions on the search ability of our multiobjective fuzzy GBML algorithms through computational experiments.",10.1109/SoCPaR.2009.74,Fuzzy genetics-based machine learning;Evolutionary multiobjective optimization;Fuzzy rules;Fuzzy partitions;Pattern classification problems,,0.0,1.0
Multiobjective Fuzzy Genetics-Based Machine Learning for Multi-Label Classification,Y. Omozaki; N. Masuyama; Y. Nojima; H. Ishibuchi,2020 IEEE International Conference on Fuzzy Systems (FUZZ-IEEE),2020.0,"In multi-label classification problems, multiple class labels are assigned to each instance. Two approaches have been studied in the literature. One is a data transformation approach, which transforms a multi-label dataset into a number of singlelabel datasets. However, this approach often loses the correlation information among classes in the multi-class assignment. The other is a method adaptation approach where a conventional classification method is extended to multi-label classification. Recently, some explainable classification models for multi-label classification have been proposed. Their high interpretability has also been discussed with respect to the transparency of the classification process. Although the explainability is a well-known advantage of fuzzy systems, their applications to multi-label classification have not been well studied. Since multi-label classification problems often have vague class boundaries, fuzzy systems seem to be a promising approach to multi-label classification. In this paper, we propose a new multiobjective evolutionary fuzzy system, which can be categorized as a method adaptation approach. The proposed algorithm produces nondominated classifiers with different tradeoffs between accuracy and complexity. We examine the behavior of the proposed algorithm using synthetic multi-label datasets. We also compare the proposed algorithm with five representative algorithms. Our experimental results on real-world datasets show that the obtained fuzzy classifiers with a small number of fuzzy rules have high transparency and comparable generalization ability to the other examined multi-label classification algorithms.",10.1109/FUZZ48607.2020.9177804,multi-label classification;multiobjective fuzzy genetics-based machine learning;fuzzy rule-based classification system;method adaptation approach,1.0,0.0,1.0
Effects of heuristic rule generation from multiple patterns in multiobjective fuzzy genetics-based machine learning,Y. Nojima; K. Watanabe; H. Ishibuchi,2015 IEEE Congress on Evolutionary Computation (CEC),2015.0,"Fuzzy genetics-based machine learning (FGBML) has frequently been used for fuzzy classifier design. It is one of the promising evolutionary machine learning (EML) techniques from the viewpoint of data mining. This is because FGBML can generate accurate classifiers with linguistically interpretable fuzzy if-then rules. Of course, a classifier with tens of thousands of if-then rules is not linguistically understandable. Thus, the complexity minimization of fuzzy classifiers should be considered together with the accuracy maximization. In previous studies, we proposed hybrid FGBML and its multiobjective formulation (MoFGBML) to handle both the accuracy maximization and the complexity minimization simultaneously. MoFGBML can obtain a number of non-dominated classifiers with different tradeoffs between accuracy and complexity. In this paper, we focus on heuristic rule generation in MoFGBML to improve the search performance. In the original heuristic rule generation, each if-then rule is generated from a randomly-selected training pattern in a heuristic manner. This operation is performed at population initialization and during evolution. To generate more generalized rules according to the training data, we propose new heuristic rule generation where each rule is generated from multiple training patterns. Through computational experiments using some benchmark data sets, we discuss the effects of the proposed operation on the search performance of our MoFGBML.",10.1109/CEC.2015.7257262,Fuzzy genetics-based machine learning;heuristic rule generation;evolutionary multiobjective optimization,5.0,0.0,1.0
Multiobjective Particle Swarm Optimization for Feature Selection With Fuzzy Cost,Y. Hu; Y. Zhang; D. Gong,IEEE Transactions on Cybernetics,2021.0,"Feature selection (FS) is an important data processing technique in the field of machine learning. There have been various FS methods, but all assume that the cost associated with a feature is precise, which restricts their real applications. Focusing on the FS problem with fuzzy cost, a fuzzy multiobjective FS method with particle swarm optimization, called PSOMOFS, is studied in this article. The proposed method develops a fuzzy dominance relationship to compare the goodness of candidate particles and defines a fuzzy crowding distance measure to prune the elitist archive and determine the global leader of particles. Also, a tolerance coefficient is introduced into the proposed method to ensure that the Pareto-optimal solutions obtained satisfy decision makers' preferences. The developed method is used to tackle a series of the UCI datasets and is compared with three fuzzy multiobjective evolutionary methods and three typical multiobjective FS methods. Experimental results show that the proposed method can achieve feature sets with superior performances in approximation, diversity, and feature cost.",10.1109/TCYB.2020.3015756,Feature selection (FS);fuzzy cost;multiobjective optimization;particle swarm optimization (PSO),37.0,0.0,1.0
