Title,Authors,Publisher,Year,Abstract,DOI,Keywords,Citations,Remove - Title,Second Filter
Controlling overfitting with multi-objective support vector machines,Mierswa I.,Proceedings of GECCO 2007: Genetic and Evolutionary Computation Conference,2007.0,"Recently, evolutionary computation has been successfully integrated into statistical learning methods. A Support Vector Machine (SVM) using evolution strategies for its optimization problem frequently deliver better results with respect to the optimization criterion and the prediction accuracy. Moreover, evolutionary computation allows for the efficient large margin optimization of a huge family of new kernel functions, namely non-positive semi definite kernels as the Epanechnikov kernel. For these kernel functions, evolutionary SVM even outperform other learning methods like the Relevance Vector Machine. In this paper, we will discuss another major advantage of evolutionary SVM compared to traditional SVM solutions: we can explicitly optimize the inherent trade-off between training error and model complexity by embedding multi-objective optimization into the evolutionary SVM. This leads to three advantages: first, it is no longer necessary to tune the SVM parameter C which weighs both conflicting criteria. This is a very time-consuming task for traditional SVM. Second, the shape and size of the Pareto front give interesting insights about the complexity of the learning task at hand. Finally, the user can actually see the point where overfitting occurs and can easily select a solution from the Pareto front best suiting his or her needs. Copyright 2007 ACM.",10.1145/1276958.1277323,Evolution strategies; Kernel methods; Machine learning; Support vector machines,20.0,0.0,1.0
Pareto-coevolutionary genetic programming for problem decomposition in multi-class classification,"Lichodzijewski P., Heywood M.I.",Proceedings of GECCO 2007: Genetic and Evolutionary Computation Conference,2007.0,"A bid-based approach for coevolving Genetic Programming classifiers is presented. The approach coevolves a population of learners thatdecompose the instance space by way of their aggregate bidding behaviour. To reduce computation overhead, a small, relevant, subsetof training exemplars is (competitively) coevolved alongside the learners. The approach solves multi-class problems using a single population and is evaluated on three large datasets. It is found tobe competitive, especially compared to classifier systems, whilesignificantly reducing the computation overhead associated withtraining. Copyright 2007 ACM.",10.1145/1276958.1277058,Classification; Coevolution; Genetic programming; Problem decomposition; Subset selection; Supervised learning; Training efficiency,17.0,0.0,1.0
Pareto analysis for the selection of classifier ensembles,"Dos Santos E.M., Sabourin R., Maupin P.",GECCO'08: Proceedings of the 10th Annual Conference on Genetic and Evolutionary Computation 2008,2008.0,"The overproduce-and-choose strategy involves the generation of an initial large pool of candidate classifiers and it is intended to test different candidate ensembles in order to select the best performing solution. The ensemble's error rate, ensemble size and diversity measures are the most frequent search criteria employed to guide this selection. By applying the error rate, we may accomplish the main objective in Pattern Recognition and Machine Learning, which is to find high-performance predictors. In terms of ensemble size, the hope is to increase the recognition rate while minimizing the number of classifiers in order to meet both the performance and low ensemble size requirements. Finally, ensembles can be more accurate than individual classifiers only when classifier members present diversity among themselves. In this paper we apply two Pareto front spread quality measures to analyze the relationship between the three main search criteria used in the overproduce-and-choose strategy. Experimental results conducted demonstrate that the combination of ensemble size and diversity does not produce conflicting multi-objective optimization problems. Moreover, we cannot decrease the generalization error rate by combining this pair of search criteria. However, when the error rate is combined with diversity or the ensemble size, we found that these measures are conflicting objective functions and that the performances of the solutions are much higher. Copyright 2008 ACM.",10.1145/1389095.1389229,Classifier ensembles; Diversity measures; Ensemble selection; Pareto analysis,10.0,0.0,1.0
Evolutionary multi-objective rule selection for classification rule mining,"Ishibuchi H., Kuwajima I., Nojima Y.",Studies in Computational Intelligence,2008.0,"This chapter discusses the application of evolutionary multi-objective optimization (EMO) to classification rule mining. In the field of classification rule mining, classifiers are designed through the following two phases: rule discovery and rule selection. In the rule discovery phase, a large number of classification rules are extracted from training data. This phase is based on two rule evaluation criteria: support and confidence. An association rule mining technique such as Apriori is usually used to extract classification rules satisfying pre-specified threshold values of the minimum support and confidence. In some studies, EMO algorithms were used to search for Pareto-optimal rules with respect to support and confidence. On the other hand, a small number of rules are selected from the extracted rules to design an accurate and compact classifier in the rule selection phase. A heuristic rule sorting criterion is usually used for rule selection. In some studies, EMO algorithms were used for multi-objective rule selection to maximize the accuracy of rule sets and minimize their complexity. In this chapter, first we explain the above-mentioned two phases in classification rule mining. Next we explain the search for Pareto-optimal rules and the search for Pareto-optimal rule sets. Then we explain evolutionary multi-objective rule selection as a post processing procedure in the second phase of classification rule mining. A number of Pareto-optimal rule sets are found from a large number of candidate rules, which are extracted from training data in the first phase. Finally we show experimental results on some data sets from the UCI machine learning repository. Through computational experiments, we demonstrate that evolutionary rule selection can drastically decrease the number of extracted rules without severely degrading their classification accuracy. We also examine the relation between Paretooptimal rules and Pareto- optimal rule sets. © 2008 Springer-Verlag Berlin Heidelberg.",10.1007/978-3-540-77467-9_3,,8.0,0.0,1.0
Simultaneous feature selection and classification via minimax probability machine,"Yang L., Wang L., Sun Y., Zhang R.",International Journal of Computational Intelligence Systems,2010.0,"This paper presents a novel method for simultaneous feature selection and classification by incorporating a robust L1-norm into the objective function of Minimax Probability Machine (MPM). A fractional programming framework is derived by using a bound on the misclassification error involving the mean and covariance of the data. Furthermore, the problems are solved by the Quadratic Interpolation method. Experiments show that our methods can select fewer features to improve the generalization compared to MPM, which illustrates the effectiveness of the proposed algorithms. © 2010 Taylor & Francis Group, LLC.",10.1080/18756891.2010.9727738,Feature selection; Machine learning; Minimax probability machine; Probability of misclassification,19.0,0.0,1.0
Generalization improvement of radial basis function network based on multi-objective particle swarm optimization,"Qasem S.N., Shamsuddin S.M.",Journal of Artificial Intelligence,2010.0,"The problem of unsupervised and supervised learning of RBF networks is discussed with Multi-Objective Particle Swarm Optimization (MOPSO). This study presents an evolutionary multi-objective selection method of RBF networks structure. The candidates of RBF networks structures are encoded into particles in PSO. These particles evolve toward Pareto-optimal front defined by several objective functions with model accuracy and complexity. This study suggests an approach of RBF network training through simultaneous optimization of architectures and connections with PSO-based multi-objective algorithm. Present goal is to determine whether MOPSO can train RBF networks and the performance is validated on accuracy and complexity. The experiments are conducted on two benchmark datasets obtained from the machine learning repository. The results show that; the best results are obtained for our proposed method that has obtained 100 and 80.21 % classification accuracy from the experiments made on the data taken from breast cancer and diabetes diseases database, respectively. The results also show that our approach provides an effective means to solve multi-objective RBF networks and outperforms multi-objective genetic algorithm. © 2010 Asian Network for Scientific Information.",10.3923/jai.2010.1.16,Elitist non-dominated sorting genetic algorithm; Hybrid learning; Multi-objective optimization; Multi-objective particle swarm optimization; Radial basis function network,16.0,0.0,1.0
DBSCAN-based multi-objective niching to approximate equivalent pareto-subsets,"Kramer O., Danielsiek H.","Proceedings of the 12th Annual Genetic and Evolutionary Computation Conference, GECCO '10",2010.0,"In systems optimization and machine learning multiple alternative solutions may exist in different parts of decision space for the same parts of the Pareto-front. The detection of equivalent Pareto-subsets may be desirablethis paper we introduce a niching method that approximates Paretooptimal solutions with diversity mechanisms in objective and decision space. For diversity in objective space we use rake selection, a selection method based on the distances to reference lines in objective space. For diversity in decision space we introduce a niching approach that uses the density-based clustering method DBSCAN. The clustering process assigns the population to niches while the multi-objective optimization process concentrates on each niche independently. We introduce an indicator for the adaptive control of clustering processes, and extend rake selection by the concept of adaptive corner points. The niching method is experimentally validated on parameterized test function with the help of the S-metric. Copyright 2010 ACM.",10.1145/1830483.1830575,Hybrid evolutionary multiobjective algorithm; Hybrid metaheuristics; Local search; Memetic algorithms,16.0,0.0,1.0
Feature selection for multi-purpose predictive models: A many-objective task,"Reynolds A.P., Corne D.W., Chantler M.J.",Lecture Notes in Computer Science (including subseries Lecture Notes in Artificial Intelligence and Lecture Notes in Bioinformatics),2010.0,"The target of machine learning is a predictive model that performs well on unseen data. Often, such a model has multiple intended uses, related to different points in the tradeoff between (e.g.) sensitivity and specificity. Moreover, when feature selection is required, different feature subsets will suit different target performance characteristics. Given a feature selection task with such multiple distinct requirements, one is in fact faced with a very-many-objective optimization task, whose target is a Pareto surface of feature subsets, each specialized for (e.g.) a different sensitivity/specificity tradeoff profile. We argue that this view has many advantages. We motivate, develop and test such an approach. We show that it can be achieved successfully using a dominance-based multiobjective algorithm, despite an arbitrarily large number of objectives. © 2010 Springer-Verlag.",10.1007/978-3-642-15844-5_39,,7.0,0.0,1.0
Inducing multi-objective clustering ensembles with genetic programming,"Coelho A.L.V., Fernandes E., Faceli K.",Neurocomputing,2010.0,"The recent years have witnessed a growing interest in two advanced strategies to cope with the data clustering problem, namely, clustering ensembles and multi-objective clustering. In this paper, we present a genetic programming based approach that can be considered as a hybrid of these strategies, thereby allowing that different hierarchical clustering ensembles be simultaneously evolved taking into account complementary validity indices. Results of computational experiments conducted with artificial and real datasets indicate that, in most of the cases, at least one of the Pareto optimal partitions returned by the proposed approach compares favorably or go in par with the consensual partitions yielded by two well-known clustering ensemble methods in terms of clustering quality, as gauged by the corrected Rand index. © 2010 Elsevier B.V.",10.1016/j.neucom.2010.09.014,Cluster analysis; Ensembles; Genetic programming; Multi-objective optimization,14.0,0.0,1.0
Smart PAC-learners,"Darnstädt M., Simon H.U.",Theoretical Computer Science,2011.0,"The PAC-learning model is distribution-independent in the sense that the learner must reach a learning goal with a limited number of labeled random examples without any prior knowledge of the underlying domain distribution. In order to achieve this, one needs generalization error bounds that are valid uniformly for every domain distribution. These bounds are (almost) tight in the sense that there is a domain distribution which does not admit a generalization error being significantly smaller than the general bound. Note however that this leaves open the possibility to achieve the learning goal faster if the underlying distribution is ""simple"". Informally speaking, we say a PAC-learner L is ""smart"" if, for a ""vast majority"" of domain distributions D, L does not require significantly more examples to reach the ""learning goal"" than the best learner whose strategy is specialized to D. In this paper, focusing on sample complexity and ignoring computational issues, we show that smart learners do exist. This implies (at least from an information-theoretical perspective) that full prior knowledge of the domain distribution (or access to a huge collection of unlabeled examples) does (for a vast majority of domain distributions) not significantly reduce the number of labeled examples required to achieve the learning goal. © 2010 Elsevier B.V. All rights reserved.",10.1016/j.tcs.2010.12.053,Learning under a fixed distribution; Machine learning; Minimax theorem; PAC-learning; Semi-supervised learning; Smart PAC-learner; Value of unlabeled data,5.0,0.0,1.0
Evolving ensembles in Multi-objective Genetic Programming for classification with unbalanced data,"Bhowan U., Johnston M., Zhang M.","Genetic and Evolutionary Computation Conference, GECCO'11",2011.0,"Machine learning algorithms can suffer a performance bias when data sets are unbalanced. This paper proposes a Multi-objective Genetic Programming approach using negative correlation learning to evolve accurate and diverse ensembles of non-dominated solutions where members vote on class membership. We also compare two popular Pareto-based fitness schemes on the classification tasks. We show that the evolved ensembles achieve high accuracy on both classes using six unbalanced binary data sets, and that this performance is usually better than many of its individual members. Copyright 2011 ACM.",10.1145/2001576.2001756,Class imbalance; Classification; Evolutionary multi-objective optimisation; Genetic programming,25.0,0.0,1.0
Ensembles and multiple classifiers: A game-theoretic view,Cesa-Bianchi N.,Lecture Notes in Computer Science (including subseries Lecture Notes in Artificial Intelligence and Lecture Notes in Bioinformatics),2011.0,"The study of multiple classifier systems is a fundamental topic in modern machine learning. However, early work on aggregation of predictors can be traced back to the Fifties, in the area of game theory. At that time, the pioneering work of James Hannan [11] and David Blackwell [2] laid down the foundations of repeated game theory. In a nutshell, a repeated game is the game-theoretic interpretation of learning. In games played once, lacking any information about the opponent, the best a player can do is to play the minimax strategy (the best strategy against the worst possible opponent). In repeated games, by examining the history of past opponent moves, the player acquires information about the opponent's behavior and can adapt to it, in order to achieve a better payoff than that guaranteed by the minimax strategy. © 2011 Springer-Verlag.",10.1007/978-3-642-21557-5_2,,,0.0,1.0
On the curse of dimensionality in supervised learning of smooth regression functions,"Liitiäinen E., Corona F., Lendasse A.",Neural Processing Letters,2011.0,"In this paper, the effect of dimensionality on the supervised learning of infinitely differentiable regression functions is analyzed. By invoking the Van Trees lower bound, we prove lower bounds on the generalization error with respect to the number of samples and the dimensionality of the input space both in a linear and non-linear context. It is shown that in non-linear problems without prior knowledge, the curse of dimensionality is a serious problem. At the same time, we speculate counter-intuitively that sometimes supervised learning becomes plausible in the asymptotic limit of infinite dimensionality. © 2011 Springer Science+Business Media, LLC.",10.1007/s11063-011-9188-7,Analytic function; High dimensional; Minimax; Nonparametric regression; Supervised learning; Van Trees,4.0,0.0,1.0
Manifold-regularized minimax probability machine,"Yoshiyama K., Sakurai A.",Lecture Notes in Computer Science (including subseries Lecture Notes in Artificial Intelligence and Lecture Notes in Bioinformatics),2012.0,"In this paper we propose Manifold-Regularized Minimax Probability Machine, called MRMPM. We show that Minimax Probability Machine can properly be extended to semi-supervised version in the manifold regularization framework and that its kernelized version is obtained for non-linear case. Our experiments show that the proposed methods achieve results competitive to existing learning methods, such as Laplacian Support Vector Machine and Laplacian Regularized Least Square for publicly available datasets from UCI machine learning repository. © 2012 Springer-Verlag.",10.1007/978-3-642-28258-4_5,,4.0,0.0,1.0
Coevolutionary learning of neural network ensemble for complex classification tasks,"Tian J., Li M., Chen F., Kou J.",Pattern Recognition,2012.0,"Ensemble approaches to classification have attracted a great deal of interest recently. This paper presents a novel method for designing the neural network ensemble using coevolutionary algorithm. The bootstrap resampling procedure is employed to obtain different training subsets that are used to estimate different component networks of the ensemble. Then the cooperative coevolutionary algorithm is developed to optimize the ensemble model via the divide-and-cooperative mechanism. All component networks are coevolved in parallel in the scheme of interacting co-adapted subpopulations. The fitness of an individual from a particular subpopulation is assessed by associating it with the representatives from other subpopulations. In order to promote the cooperation of all component networks, the proposed method considers both the accuracy and the diversity among the component networks that are evaluated using the multi-objective Pareto optimality measure. A hybrid output-combination method is designed to determine the final ensemble output. Experimental results illustrate that the proposed method is able to obtain neural network ensemble models with better classification accuracy in comparison with currently popular ensemble algorithms. © 2011 Elsevier Ltd All rights reserved.",10.1016/j.patcog.2011.09.012,Classification; Coevolutionary algorithm; Ensemble learning; Neural network,30.0,0.0,1.0
A computational geometry approach for pareto-optimal selection of neural networks,"Torres L.C.B., Castro C.L., Braga A.P.",Lecture Notes in Computer Science (including subseries Lecture Notes in Artificial Intelligence and Lecture Notes in Bioinformatics),2012.0,"This paper presents a Pareto-optimal selection strategy for multiobjective learning that is based on the geometry of the separation margin between classes. The Gabriel Graph, a method borrowed from Computational Geometry, is constructed in order to obtain margin patterns and class borders. From border edges, a target separator is obtained in order to obtain a large margin classifier. The selected model from the generated Pareto-set is the one that is closer to the target separator. The method presents robustness in both synthetic and real benchmark datasets. It is efficient for Pareto-Optimal selection of neural networks and no claim is made that the obtained solution is equivalent to a maximum margin separator. © 2012 Springer-Verlag.",10.1007/978-3-642-33266-1_13,classification; decision-making; gabriel graph; multiobjective machine learning,2.0,0.0,1.0
A classification model based on incomplete information on features in the form of their average values,"Utkin L.V., Zhuk Y.A., Selikhovkin I.A.",Scientific and Technical Information Processing,2012.0,"This paper presents a model of classification under incomplete information in the form of mathematical expectations of features; it is based on the minimax (minimin) strategy of decision making. The discriminant function is calculated by maximization (minimization) of the risk functional as a measure of misclassification, by a set of distributions of probabilities with bounds determined by information on features, and minimization by the set of parameters. The algorithm is reduced to solution of the parametric problem of linear programming. © 2012 Allerton Press, Inc.",10.3103/S0147688212060068,classification; linear programming; machine learning; mathematical expectation; minimax strategy; risk functional; the loss function,3.0,0.0,1.0
Categorical feature reduction using multi objective genetic Algorithm in cluster analysis,"Dutta D., Dutta P., Sil J.",Lecture Notes in Computer Science (including subseries Lecture Notes in Artificial Intelligence and Lecture Notes in Bioinformatics),2013.0,"In the paper, real coded multi objective genetic algorithm based K-clustering method has been studied, K represents the number of clusters. In K-clustering algorithm value of K is known. The searching power of Genetic Algorithm (GA) is exploited to search for suitable clusters and centers of clusters so that intra-cluster distance (Homogeneity, H) and inter-cluster distances (Separation, S) are simultaneously optimized. It is achieved by measuring H and S using Mod distance per feature metric, suitable for categorical features (attributes). We have selected 3 benchmark data sets from UCI Machine Learning Repository containing categorical features only. The paper proposes two versions of MOGA based K-clustering algorithm. In proposed MOGA (H, S), all features are taking part in building chromosomes and calculation of H and S values. In MOGA-Feature-Selection (H, S), selected features take part to build chromosomes, relevant for clusters. Here, K-modes is hybridized with GA. We have used hybridized GA to combine global searching capabilities of GA with local searching capabilities of K-modes. Considering context sensitivity, we have used a special crossover operator called ""pairwise crossover"" and ""substitution"". The main contribution of this paper is simultaneous dimensionality reduction and optimization of objectives using MOGA. © 2013 Springer-Verlag Berlin Heidelberg.",10.1007/978-3-642-45318-2_7,Clustering; dimensionality reduction; homogeneity and separation; Pareto optimal front; real coded multi objective genetic algorithm,3.0,0.0,1.0
Robust novelty detection in the framework of a contamination neighbourhood,"Utkin L.V., Zhuk Y.A.",International Journal of Intelligent Information and Database Systems,2013.0,A novelty detection robust model is studied in the paper. It is based on contaminated (robust) models which produce a set of probability distributions of data points instead of the empirical distribution. The minimax and minimin strategies are used to construct optimal separating functions. An algorithm for computing the optimal parameters of the novelty detection model is reduced to a finite number of standard SVM tasks with weighted data points. Experimental results with synthetic and some real data illustrate the proposed novelty detection robust model. Copyright © 2013 Inderscience Enterprises Ltd.,10.1504/IJIIDS.2013.053830,Classification; Machine learning; Minimax strategy; Novelty detection; Quadratic programming; Support vector machine; SVM,5.0,0.0,1.0
